{
  "$schema": "https://json-schema.org/draft/2020-12/schema",
  "title": "DeveloperConversationTaxonomy",
  "type": "object",
  "additionalProperties": false,
  "required": ["task_types", "difficulties", "languages", "roles", "tools", "interaction_patterns"],
  "properties": {
    "$schema": { "type": "string" },
    "task_types": { "$ref": "#/$defs/nonEmptyUniqueStringArray" },
    "difficulties": { "$ref": "#/$defs/nonEmptyUniqueStringArray" },
    "languages": { "$ref": "#/$defs/nonEmptyUniqueStringArray" },
    "roles": { "$ref": "#/$defs/nonEmptyUniqueStringArray" },
    "tools": { "$ref": "#/$defs/nonEmptyUniqueStringArray" },
    "interaction_patterns": { "$ref": "#/$defs/nonEmptyUniqueStringArray" }
  },
  "$defs": {
    "nonEmptyUniqueStringArray": {
      "type": "array",
      "minItems": 1,
      "uniqueItems": true,
      "items": {
        "type": "string",
        "pattern": "^[a-z][a-z0-9_]*$"
      }
    }
  }
}
